[
  {
    "risk_id": "RSK_01",
    "threat_id": "TH_01",
    "damage_scenario_id": "DS_01",
    "attack_id": "AT_01",
    "impact_id": "IM_01",
    "asset_id": "AS_01",
    "impact_rating_value": 2,
    "impact_rating_label": "Major",
    "afr_value": 5,
    "afr_label": "very high",
    "risk_score": 10,
    "risk_level": "high",
    "risk_rank": 1,
    "created_timestamp": "2026-10-09T12:54:37.961Z"
  },
  {
    "risk_id": "RSK_02",
    "threat_id": "TH_06",
    "damage_scenario_id": "DS_06",
    "attack_id": "AT_06",
    "impact_id": "IM_06",
    "asset_id": "AS_03",
    "impact_rating_value": 2,
    "impact_rating_label": "Major",
    "afr_value": 5,
    "afr_label": "very high",
    "risk_score": 10,
    "risk_level": "high",
    "risk_rank": 2,
    "created_timestamp": "2026-10-09T12:54:37.961Z"
  },
  {
    "risk_id": "RSK_03",
    "threat_id": "TH_03",
    "damage_scenario_id": "DS_03",
    "attack_id": "AT_03",
    "impact_id": "IM_03",
    "asset_id": "AS_02",
    "impact_rating_value": 2,
    "impact_rating_label": "Major",
    "afr_value": 4,
    "afr_label": "high",
    "risk_score": 8,
    "risk_level": "high",
    "risk_rank": 3,
    "created_timestamp": "2026-10-09T12:54:37.961Z"
  },
  {
    "risk_id": "RSK_04",
    "threat_id": "TH_07",
    "damage_scenario_id": "DS_07",
    "attack_id": "AT_07",
    "impact_id": "IM_07",
    "asset_id": "AS_04",
    "impact_rating_value": 2,
    "impact_rating_label": "Major",
    "afr_value": 4,
    "afr_label": "high",
    "risk_score": 8,
    "risk_level": "high",
    "risk_rank": 4,
    "created_timestamp": "2026-10-09T12:54:37.961Z"
  },
  {
    "risk_id": "RSK_05",
    "threat_id": "TH_08",
    "damage_scenario_id": "DS_08",
    "attack_id": "AT_08",
    "impact_id": "IM_08",
    "asset_id": "AS_05",
    "impact_rating_value": 2,
    "impact_rating_label": "Major",
    "afr_value": 4,
    "afr_label": "high",
    "risk_score": 8,
    "risk_level": "high",
    "risk_rank": 5,
    "created_timestamp": "2026-10-09T12:54:37.961Z"
  },
  {
    "risk_id": "RSK_06",
    "threat_id": "TH_10",
    "damage_scenario_id": "DS_10",
    "attack_id": "AT_10",
    "impact_id": "IM_10",
    "asset_id": "AS_07",
    "impact_rating_value": 2,
    "impact_rating_label": "Major",
    "afr_value": 3,
    "afr_label": "medium",
    "risk_score": 6,
    "risk_level": "medium",
    "risk_rank": 6,
    "created_timestamp": "2026-10-09T12:54:37.961Z"
  },
  {
    "risk_id": "RSK_07",
    "threat_id": "TH_02",
    "damage_scenario_id": "DS_02",
    "attack_id": "AT_02",
    "impact_id": "IM_02",
    "asset_id": "AS_01",
    "impact_rating_value": 1,
    "impact_rating_label": "Moderate",
    "afr_value": 4,
    "afr_label": "high",
    "risk_score": 4,
    "risk_level": "medium",
    "risk_rank": 7,
    "created_timestamp": "2026-10-09T12:54:37.961Z"
  },
  {
    "risk_id": "RSK_08",
    "threat_id": "TH_09",
    "damage_scenario_id": "DS_09",
    "attack_id": "AT_09",
    "impact_id": "IM_09",
    "asset_id": "AS_06",
    "impact_rating_value": 1,
    "impact_rating_label": "Moderate",
    "afr_value": 4,
    "afr_label": "high",
    "risk_score": 4,
    "risk_level": "medium",
    "risk_rank": 8,
    "created_timestamp": "2026-10-09T12:54:37.961Z"
  },
  {
    "risk_id": "RSK_09",
    "threat_id": "TH_11",
    "damage_scenario_id": "DS_11",
    "attack_id": "AT_11",
    "impact_id": "IM_11",
    "asset_id": "AS_08",
    "impact_rating_value": 1,
    "impact_rating_label": "Moderate",
    "afr_value": 4,
    "afr_label": "high",
    "risk_score": 4,
    "risk_level": "medium",
    "risk_rank": 9,
    "created_timestamp": "2026-10-09T12:54:37.961Z"
  },
  {
    "risk_id": "RSK_10",
    "threat_id": "TH_04",
    "damage_scenario_id": "DS_04",
    "attack_id": "AT_04",
    "impact_id": "IM_04",
    "asset_id": "AS_02",
    "impact_rating_value": 1,
    "impact_rating_label": "Moderate",
    "afr_value": 3,
    "afr_label": "medium",
    "risk_score": 3,
    "risk_level": "low",
    "risk_rank": 10,
    "created_timestamp": "2026-10-09T12:54:37.961Z"
  },
  {
    "risk_id": "RSK_11",
    "threat_id": "TH_05",
    "damage_scenario_id": "DS_05",
    "attack_id": "AT_05",
    "impact_id": "IM_05",
    "asset_id": "AS_03",
    "impact_rating_value": 1,
    "impact_rating_label": "Moderate",
    "afr_value": 2,
    "afr_label": "low",
    "risk_score": 2,
    "risk_level": "low",
    "risk_rank": 11,
    "created_timestamp": "2026-10-09T12:54:37.961Z"
  }
]
